{
  "ir_type": "world",
  "version": "0.1",
  "world_id": "mock_world",
  "name": "Mock Coastal City",
  "description": null,
  "scale": {
    "width_m": 3000.0,
    "depth_m": 2000.0
  },
  "theme": "neutral_urban",
  "tags": [
    "coastal",
    "compact",
    "mock"
  ],
  "districts": [
    {
      "id": "old_town",
      "name": "Old Town",
      "district_type": "old_dense",
      "polygon": {
        "points": [
          {
            "x": 75.0,
            "y": 50.0
          },
          {
            "x": 1425.0,
            "y": 50.0
          },
          {
            "x": 1425.0,
            "y": 950.0
          },
          {
            "x": 75.0,
            "y": 950.0
          }
        ]
      },
      "density": "high",
      "height_profile": "low",
      "tags": [
        "narrow",
        "historic"
      ],
      "gameplay_tags": [
        "stealth",
        "alleys"
      ]
    },
    {
      "id": "business_core",
      "name": "Business Core",
      "district_type": "business",
      "polygon": {
        "points": [
          {
            "x": 1575.0,
            "y": 50.0
          },
          {
            "x": 2925.0,
            "y": 50.0
          },
          {
            "x": 2925.0,
            "y": 950.0
          },
          {
            "x": 1575.0,
            "y": 950.0
          }
        ]
      },
      "density": "very_high",
      "height_profile": "high",
      "tags": [
        "skyscrapers"
      ],
      "gameplay_tags": [
        "vertical"
      ]
    },
    {
      "id": "port_zone",
      "name": "Port Zone",
      "district_type": "industrial",
      "polygon": {
        "points": [
          {
            "x": 75.0,
            "y": 1050.0
          },
          {
            "x": 1425.0,
            "y": 1050.0
          },
          {
            "x": 1425.0,
            "y": 1950.0
          },
          {
            "x": 75.0,
            "y": 1950.0
          }
        ]
      },
      "density": "high",
      "height_profile": "mid",
      "tags": [
        "port",
        "containers"
      ],
      "gameplay_tags": [
        "industrial_combat"
      ]
    },
    {
      "id": "airport_island",
      "name": "Airport Island",
      "district_type": "airport",
      "polygon": {
        "points": [
          {
            "x": 1575.0,
            "y": 1050.0
          },
          {
            "x": 2925.0,
            "y": 1050.0
          },
          {
            "x": 2925.0,
            "y": 1950.0
          },
          {
            "x": 1575.0,
            "y": 1950.0
          }
        ]
      },
      "density": "low",
      "height_profile": "low",
      "tags": [
        "offshore",
        "restricted"
      ],
      "gameplay_tags": [
        "security_high"
      ]
    }
  ],
  "roads": [
    {
      "id": "primary_loop",
      "name": "Primary Loop",
      "road_type": "primary",
      "points": [
        {
          "x": 750.0,
          "y": 500.0
        },
        {
          "x": 2250.0,
          "y": 500.0
        },
        {
          "x": 750.0,
          "y": 1500.0
        }
      ],
      "width_m": 8.0,
      "tags": []
    }
  ],
  "water_bodies": [
    {
      "id": "the_sea",
      "name": "Coastal Sea",
      "water_type": "sea",
      "polygon": {
        "points": [
          {
            "x": 15.0,
            "y": -48.0
          },
          {
            "x": 1485.0,
            "y": -48.0
          },
          {
            "x": 1485.0,
            "y": 72.0
          },
          {
            "x": 15.0,
            "y": 72.0
          }
        ]
      },
      "tags": []
    },
    {
      "id": "port_harbor",
      "name": "Port Harbor",
      "water_type": "harbor",
      "polygon": {
        "points": [
          {
            "x": 1515.0,
            "y": -48.0
          },
          {
            "x": 2985.0,
            "y": -48.0
          },
          {
            "x": 2985.0,
            "y": 72.0
          },
          {
            "x": 1515.0,
            "y": 72.0
          }
        ]
      },
      "tags": []
    }
  ],
  "pois": [
    {
      "id": "old_town_shrine",
      "name": "Old Town Shrine",
      "poi_type": "landmark",
      "position": {
        "x": 840.0,
        "y": 410.0
      },
      "tags": [
        "landmark"
      ],
      "gameplay_tags": []
    },
    {
      "id": "central_plaza",
      "name": "Central Plaza",
      "poi_type": "plaza",
      "position": {
        "x": 2145.0,
        "y": 530.0
      },
      "tags": [
        "gathering"
      ],
      "gameplay_tags": []
    }
  ],
  "scene_slots": [
    {
      "id": "old_town_alley_slot",
      "name": "Old Town Alley Slot",
      "district_id": "old_town",
      "position": {
        "x": 690.0,
        "y": 460.0
      },
      "rotation_deg": 0.0,
      "size": {
        "width_m": 60.0,
        "depth_m": 40.0
      },
      "allowed_scene_types": [
        "exterior_location"
      ],
      "connection_rules": [],
      "tags": []
    },
    {
      "id": "port_warehouse_slot",
      "name": "Port Warehouse Slot",
      "district_id": "port_zone",
      "position": {
        "x": 750.0,
        "y": 1460.0
      },
      "rotation_deg": 0.0,
      "size": {
        "width_m": 60.0,
        "depth_m": 40.0
      },
      "allowed_scene_types": [
        "interior"
      ],
      "connection_rules": [],
      "tags": []
    }
  ],
  "constraints": []
}
