{
  "ir_type": "world",
  "version": "0.1",
  "world_id": "world_jisso_city",
  "name": "Jisso City",
  "description": "Compact open-world city: business north, nightlife center, port south, offshore airport island.",
  "scale": { "width_m": 4000.0, "depth_m": 3000.0 },
  "theme": "neon_urban",
  "tags": ["city", "urban", "coastal", "harbor"],

  "districts": [
    {
      "id": "kita_central", "name": "Kita Central", "district_type": "business",
      "polygon": { "points": [
        { "x": 1500.0, "y": 2200.0 }, { "x": 2700.0, "y": 2200.0 },
        { "x": 2700.0, "y": 2900.0 }, { "x": 1500.0, "y": 2900.0 }
      ]},
      "density": "very_high", "height_profile": "high",
      "tags": ["business", "skyscrapers"], "gameplay_tags": ["dense_combat", "vertical"]
    },
    {
      "id": "sotonbori", "name": "Sotonbori", "district_type": "nightlife",
      "polygon": { "points": [
        { "x": 1500.0, "y": 1300.0 }, { "x": 2700.0, "y": 1300.0 },
        { "x": 2700.0, "y": 2200.0 }, { "x": 1500.0, "y": 2200.0 }
      ]},
      "density": "very_high", "height_profile": "mid",
      "tags": ["nightlife", "canal", "neon"], "gameplay_tags": ["crowd", "stealth"]
    },
    {
      "id": "kurogane", "name": "Kurogane", "district_type": "old_dense",
      "polygon": { "points": [
        { "x": 800.0,  "y": 1700.0 }, { "x": 1500.0, "y": 1700.0 },
        { "x": 1500.0, "y": 2400.0 }, { "x": 800.0,  "y": 2400.0 }
      ]},
      "density": "high", "height_profile": "low",
      "tags": ["old_town", "narrow"], "gameplay_tags": ["stealth", "alleys"]
    },
    {
      "id": "kiu", "name": "KIU University District", "district_type": "university",
      "polygon": { "points": [
        { "x": 2700.0, "y": 2100.0 }, { "x": 3500.0, "y": 2100.0 },
        { "x": 3500.0, "y": 2900.0 }, { "x": 2700.0, "y": 2900.0 }
      ]},
      "density": "medium", "height_profile": "mid",
      "tags": ["academic", "open_campus"], "gameplay_tags": ["public_area"]
    },
    {
      "id": "aobadai", "name": "Aobadai", "district_type": "residential",
      "polygon": { "points": [
        { "x": 500.0,  "y": 900.0 }, { "x": 1500.0, "y": 900.0 },
        { "x": 1500.0, "y": 1700.0 }, { "x": 500.0,  "y": 1700.0 }
      ]},
      "density": "medium", "height_profile": "low",
      "tags": ["residential", "schools"], "gameplay_tags": ["civilian"]
    },
    {
      "id": "takamine", "name": "Takamine", "district_type": "hill",
      "polygon": { "points": [
        { "x": 3500.0, "y": 900.0 },  { "x": 3950.0, "y": 900.0 },
        { "x": 3950.0, "y": 2900.0 }, { "x": 3500.0, "y": 2900.0 }
      ]},
      "density": "low", "height_profile": "mixed",
      "tags": ["hill", "edge", "wealthy"], "gameplay_tags": ["sniper_friendly", "verticality"]
    },
    {
      "id": "seihama", "name": "Seihama", "district_type": "coastal_urban",
      "polygon": { "points": [
        { "x": 100.0,  "y": 250.0 }, { "x": 1500.0, "y": 250.0 },
        { "x": 1500.0, "y": 900.0 }, { "x": 100.0,  "y": 900.0 }
      ]},
      "density": "medium", "height_profile": "mid",
      "tags": ["coastal", "promenade"], "gameplay_tags": ["waterfront"]
    },
    {
      "id": "minato_bay_port", "name": "Minato Bay Port", "district_type": "industrial",
      "polygon": { "points": [
        { "x": 1500.0, "y": 250.0 }, { "x": 2700.0, "y": 250.0 },
        { "x": 2700.0, "y": 1300.0 }, { "x": 1500.0, "y": 1300.0 }
      ]},
      "density": "high", "height_profile": "mid",
      "tags": ["industrial", "port", "containers"], "gameplay_tags": ["industrial_combat"]
    },
    {
      "id": "kix_airport_island", "name": "KIX Airport Island", "district_type": "airport",
      "polygon": { "points": [
        { "x": 2900.0, "y": 100.0 }, { "x": 3900.0, "y": 100.0 },
        { "x": 3900.0, "y": 700.0 }, { "x": 2900.0, "y": 700.0 }
      ]},
      "density": "low", "height_profile": "low",
      "tags": ["airport", "offshore", "restricted"], "gameplay_tags": ["security_high"]
    }
  ],

  "roads": [
    {
      "id": "road_north_primary", "name": "North Primary Boulevard", "road_type": "primary",
      "points": [
        { "x": 100.0,  "y": 2500.0 },
        { "x": 1500.0, "y": 2500.0 },
        { "x": 2700.0, "y": 2500.0 },
        { "x": 3500.0, "y": 2500.0 },
        { "x": 3950.0, "y": 2500.0 }
      ],
      "width_m": 22.0, "tags": ["primary", "trunk"]
    },
    {
      "id": "road_central_ns", "name": "Central Avenue", "road_type": "primary",
      "points": [
        { "x": 2100.0, "y": 250.0 },
        { "x": 2100.0, "y": 1300.0 },
        { "x": 2100.0, "y": 2200.0 },
        { "x": 2100.0, "y": 2900.0 }
      ],
      "width_m": 18.0
    },
    {
      "id": "road_bay_loop", "name": "Bay Loop", "road_type": "secondary",
      "points": [
        { "x": 1500.0, "y": 250.0 },
        { "x": 2700.0, "y": 250.0 },
        { "x": 2700.0, "y": 1300.0 }
      ],
      "width_m": 12.0
    },
    {
      "id": "road_kix_bridge", "name": "KIX Bridge", "road_type": "primary",
      "points": [
        { "x": 2700.0, "y": 400.0 },
        { "x": 2900.0, "y": 400.0 }
      ],
      "width_m": 14.0, "tags": ["bridge", "offshore_link"]
    },
    {
      "id": "alley_kurogane_1", "name": "Kurogane Alley", "road_type": "alley",
      "points": [
        { "x": 950.0,  "y": 1850.0 },
        { "x": 1300.0, "y": 1850.0 },
        { "x": 1300.0, "y": 2200.0 }
      ],
      "width_m": 3.0, "tags": ["narrow"]
    }
  ],

  "water_bodies": [
    {
      "id": "sotonbori_canal", "name": "Sotonbori Canal", "water_type": "canal",
      "polygon": { "points": [
        { "x": 1500.0, "y": 1600.0 }, { "x": 2700.0, "y": 1600.0 },
        { "x": 2700.0, "y": 1660.0 }, { "x": 1500.0, "y": 1660.0 }
      ]},
      "tags": ["canal", "central"]
    },
    {
      "id": "harbor_basin", "name": "Harbor Basin", "water_type": "harbor",
      "polygon": { "points": [
        { "x": 2200.0, "y": 250.0 }, { "x": 2700.0, "y": 250.0 },
        { "x": 2700.0, "y": 650.0 }, { "x": 2200.0, "y": 650.0 }
      ]}
    },
    {
      "id": "south_sea", "name": "Southern Sea", "water_type": "sea",
      "polygon": { "points": [
        { "x": 100.0,  "y": 50.0 },  { "x": 3950.0, "y": 50.0 },
        { "x": 3950.0, "y": 250.0 }, { "x": 100.0,  "y": 250.0 }
      ]},
      "tags": ["sea", "south_coast"]
    },
    {
      "id": "kix_channel", "name": "KIX Channel", "water_type": "sea",
      "polygon": { "points": [
        { "x": 2700.0, "y": 100.0 }, { "x": 2900.0, "y": 100.0 },
        { "x": 2900.0, "y": 700.0 }, { "x": 2700.0, "y": 700.0 }
      ]},
      "tags": ["sea", "channel"]
    }
  ],

  "pois": [
    { "id": "poi_kix_runway", "name": "KIX Runway", "poi_type": "runway",
      "position": { "x": 3400.0, "y": 350.0 },
      "tags": ["airport", "landmark"], "gameplay_tags": ["high_value_target"] },
    { "id": "poi_sotonbori_plaza", "name": "Sotonbori Plaza", "poi_type": "plaza",
      "position": { "x": 2100.0, "y": 1750.0 },
      "tags": ["nightlife", "crowd"] },
    { "id": "poi_kurogane_shrine", "name": "Kurogane Shrine", "poi_type": "shrine",
      "position": { "x": 1100.0, "y": 2050.0 },
      "tags": ["historical", "quiet"] },
    { "id": "poi_takamine_viewpoint", "name": "Takamine Viewpoint", "poi_type": "viewpoint",
      "position": { "x": 3750.0, "y": 2000.0 },
      "tags": ["scenic"], "gameplay_tags": ["vantage_point"] },
    { "id": "poi_kita_tower", "name": "Kita Central Tower", "poi_type": "skyscraper",
      "position": { "x": 2100.0, "y": 2600.0 },
      "tags": ["landmark", "vertical"] }
  ],

  "scene_slots": [
    {
      "id": "sotonbori_club_back_alley", "name": "Sotonbori Club Back Alley",
      "district_id": "sotonbori",
      "position": { "x": 2300.0, "y": 1850.0 }, "rotation_deg": 0.0,
      "size": { "width_m": 80.0, "depth_m": 45.0 },
      "allowed_scene_types": ["exterior_location"],
      "tags": ["alley", "nightlife"]
    },
    {
      "id": "sotonbori_nightclub_interior", "name": "Sotonbori Nightclub Interior",
      "district_id": "sotonbori",
      "position": { "x": 2400.0, "y": 1900.0 }, "rotation_deg": 0.0,
      "size": { "width_m": 60.0, "depth_m": 40.0 },
      "allowed_scene_types": ["interior"],
      "tags": ["interior", "club"]
    },
    {
      "id": "kurogane_narrow_alley", "name": "Kurogane Narrow Alley",
      "district_id": "kurogane",
      "position": { "x": 1200.0, "y": 2050.0 }, "rotation_deg": 0.0,
      "size": { "width_m": 50.0, "depth_m": 30.0 },
      "allowed_scene_types": ["exterior_location"],
      "tags": ["alley", "old_town"]
    },
    {
      "id": "minato_container_yard", "name": "Minato Container Yard",
      "district_id": "minato_bay_port",
      "position": { "x": 1900.0, "y": 700.0 }, "rotation_deg": 0.0,
      "size": { "width_m": 120.0, "depth_m": 90.0 },
      "allowed_scene_types": ["exterior_location"],
      "tags": ["industrial", "outdoor"]
    },
    {
      "id": "minato_warehouse_interior", "name": "Minato Warehouse Interior",
      "district_id": "minato_bay_port",
      "position": { "x": 2200.0, "y": 950.0 }, "rotation_deg": 0.0,
      "size": { "width_m": 70.0, "depth_m": 50.0 },
      "allowed_scene_types": ["interior"],
      "tags": ["interior", "warehouse"]
    },
    {
      "id": "kix_terminal_security_area", "name": "KIX Terminal Security Area",
      "district_id": "kix_airport_island",
      "position": { "x": 3200.0, "y": 500.0 }, "rotation_deg": 0.0,
      "size": { "width_m": 60.0, "depth_m": 40.0 },
      "allowed_scene_types": ["interior"],
      "tags": ["interior", "security", "airport"]
    }
  ],

  "constraints": [
    { "id": "c_have_slot", "constraint_type": "must_have_scene_slot", "params": { "min": 1 } },
    { "id": "c_inside_bounds", "constraint_type": "must_be_inside_bounds", "severity": "warning" }
  ]
}
